{
  "$schema": "https://json-schema.org/draft/2020-12/schema",
  "$id": "https://github.com/benzemaer/convergence-research/schemas/d2_continuous_price_construction_blocking_report.schema.json",
  "title": "D2 Continuous Price Construction Blocking Report",
  "type": "object",
  "additionalProperties": false,
  "required": ["config_version", "report_id", "task_id", "materialization_status", "target_table", "continuous_price_construction_authorized", "adjusted_price_generation_authorized", "formal_ingestion_authorized", "duckdb_written", "real_continuous_price_rows_generated", "real_continuous_price_artifact_committed", "run_manifest_created", "dataset_manifest_created", "source_snapshot_manifest_created", "raw_snapshot_read", "data_external_read", "external_api_called", "marketdb_read", "tdx_day_file_read", "raw_price_materialization_available", "raw_price_materialization_status", "adjustment_factor_materialization_available", "adjustment_factor_materialization_status", "membership_alignment_available", "membership_alignment_row_count", "next_required_decision", "current_task_remains", "next_task_after_unblock", "d2_t06_not_authorized_by_this_pr"],
  "properties": {
    "$schema": {"type": "string"},
    "config_version": {"const": "1.0.0"},
    "report_id": {"const": "D2_CONTINUOUS_PRICE_CONSTRUCTION_BLOCKING_REPORT_V1"},
    "task_id": {"const": "D2-T05"},
    "materialization_status": {"const": "blocked_pending_raw_and_factor_authorization"},
    "target_table": {"const": "d2.adjusted_market_prices"},
    "continuous_price_construction_authorized": {"const": false},
    "adjusted_price_generation_authorized": {"const": false},
    "formal_ingestion_authorized": {"const": false},
    "duckdb_written": {"const": false},
    "real_continuous_price_rows_generated": {"const": false},
    "real_continuous_price_artifact_committed": {"const": false},
    "run_manifest_created": {"const": false},
    "dataset_manifest_created": {"const": false},
    "source_snapshot_manifest_created": {"const": false},
    "raw_snapshot_read": {"const": false},
    "data_external_read": {"const": false},
    "external_api_called": {"const": false},
    "marketdb_read": {"const": false},
    "tdx_day_file_read": {"const": false},
    "raw_price_materialization_available": {"const": false},
    "raw_price_materialization_status": {"const": "blocked_pending_source_authorization"},
    "adjustment_factor_materialization_available": {"const": false},
    "adjustment_factor_materialization_status": {"const": "blocked_pending_factor_source_authorization"},
    "membership_alignment_available": {"const": true},
    "membership_alignment_row_count": {"const": 800},
    "next_required_decision": {"const": "approve_or_reject_raw_price_and_factor_materialization_before_continuous_price_construction"},
    "current_task_remains": {"const": "D2-T05"},
    "next_task_after_unblock": {"const": "D2-T05 continuous research price construction execution"},
    "d2_t06_not_authorized_by_this_pr": {"const": true}
  }
}
