{
  "$schema": "../../schemas/d2_continuous_price_construction_blocking_report.schema.json",
  "config_version": "1.0.0",
  "report_id": "D2_CONTINUOUS_PRICE_CONSTRUCTION_BLOCKING_REPORT_V1",
  "task_id": "D2-T05",
  "materialization_status": "blocked_pending_raw_and_factor_authorization",
  "target_table": "d2.adjusted_market_prices",
  "continuous_price_construction_authorized": false,
  "adjusted_price_generation_authorized": false,
  "formal_ingestion_authorized": false,
  "duckdb_written": false,
  "real_continuous_price_rows_generated": false,
  "real_continuous_price_artifact_committed": false,
  "run_manifest_created": false,
  "dataset_manifest_created": false,
  "source_snapshot_manifest_created": false,
  "raw_snapshot_read": false,
  "data_external_read": false,
  "external_api_called": false,
  "marketdb_read": false,
  "tdx_day_file_read": false,
  "raw_price_materialization_available": false,
  "raw_price_materialization_status": "blocked_pending_source_authorization",
  "adjustment_factor_materialization_available": false,
  "adjustment_factor_materialization_status": "blocked_pending_factor_source_authorization",
  "membership_alignment_available": true,
  "membership_alignment_row_count": 800,
  "next_required_decision": "approve_or_reject_raw_price_and_factor_materialization_before_continuous_price_construction",
  "current_task_remains": "D2-T05",
  "next_task_after_unblock": "D2-T05 continuous research price construction execution",
  "d2_t06_not_authorized_by_this_pr": true
}
